"SAME","주식회사 성주컴텍","25776540","데스크톱컴퓨터, 성주컴텍, TD210-GRRB20S1M, Intel Core i5 14500(2.6GHz)","979000","979000","979000","978500","978500","1238600","1238600","0","2029.09.30"
"SAME","주식회사 에이텍컴퓨터","25569824","데스크톱컴퓨터, 에이텍컴퓨터, A2SC-7NBDN, Intel Core i7 12700(2.1GHz)","979000","979000","","","","",,"0","2029.09.30"
"SAME","주식회사 티원엘에스","25916104","데스크톱컴퓨터, 티원엘에스, TSB-D11920, Intel Core i3 14100(3.5GHz)","979100","979100","979100","979000","979000","1082300","1082300","0","2029.03.18"
"SAME","주식회사 엔와이컴퓨터","25216867","데스크톱컴퓨터, 엔와이컴퓨터, NY-P135SI00, Intel Core i5 13500(2.5GHz)","979700","979700","979700","979100","979100","1259200","1259200","0","2029.09.30"
"UP","주식회사 서버앤컴퓨터","24589650","데스크톱컴퓨터, 서버앤컴퓨터, DODE-T7815, Intel Core i7 12700(2.1GHz)","980000","980000","980000","980000","980000","980000","1205200","225200","2026.04.29"
"SAME","주식회사 아이브리지닷컴","25628959","데스크톱컴퓨터, 아이브리지닷컴, M5-X45B-1A2N, i5-14500(2.6GHz)","980000","980000","980000","979700","979700","1207000","1207000","0","2028.12.03"
"SAME","(주)유투","25034151","데스크톱컴퓨터, 유투, T5D2-510/B, Intel Core i5 13500(2.5GHz)","980500","980500","980500","980000","980000","1294100","1294100","0","2029.09.30"
"SAME","사단법인 나너우리","24594845","데스크톱컴퓨터, 나너우리, IYU-S25I9, Intel Core i5 12500(3.0GHz)","981000","981000","981000","981000","981000","1221000","1221000","0","2029.09.30"
"SAME","사단법인 나너우리","24594884","데스크톱컴퓨터, 나너우리, IYU-M25I9, Intel Core 5 12500(3.0GHz)","981000","981000","981000","980500","980500","1221000","1221000","0","2029.09.30"
"SAME","주식회사 인텍","25234079","데스크톱컴퓨터, 인텍, IT176-S3516210, Intel Core i5-13500(2.5GHz)","981000","981000","981000","981000","981000","1371000","1371000","0","2029.03.14"
"SAME","위더스컴퓨터 주식회사","24935043","데스크톱컴퓨터, 위더스컴퓨터, B7T-50N516, Intel Core i5 13500(2.5GHz)","981100","981100","981100","981000","981000","1289000","1289000","0","2029.09.30"
"SAME","위더스컴퓨터 주식회사","24935039","데스크톱컴퓨터, 위더스컴퓨터, B7S-50N516, Intel Core i5 13500(2.5GHz)","981100","981100","981100","981100","981100","1289000","1289000","0","2029.09.30"
"SAME","주식회사 엔와이컴퓨터","25554373","데스크톱컴퓨터, 엔와이컴퓨터, NY-C145SI00, Intel Core i5 14500(2.6GHz)","981700","","","","","",,"0","2029.09.30"
"SAME","주식회사 엔와이컴퓨터","25554360","데스크톱컴퓨터, 엔와이컴퓨터, NY-E145SI00, Intel Core i5 14500(2.6GHz)","981700","","","","","",,"0","2029.09.30"
"UP","주식회사 주연테크","25792432","데스크톱컴퓨터, 주연테크, JA-145F5S, Intel Core i5-14500(2.6GHz)","981900","981900","981900","981100","981100","981900","1195900","214000","2029.09.30"
"UP","주식회사 주연테크","25792382","데스크톱컴퓨터, 주연테크, JS-145F5S, Intel Core i5-14500(2.6GHz)","981900","981900","981900","981900","981900","981900","1195900","214000","2029.09.30"
"UP","(주)컴트리","25797465","데스크톱컴퓨터, 컴트리, CM4-E51-B0002, Intel Core i5 14500(2.6GHz)","982010","982010","982010","981900","981900","982010","1280910","298900","2029.09.30"
"SAME","사단법인 나너우리","24594883","데스크톱컴퓨터, 나너우리, IYU-M25J9, Intel Core 5 12500(3.0GHz)","983500","983500","983500","983000","983000","1253500","1253500","0","2029.09.30"
"SAME","사단법인 나너우리","24594844","데스크톱컴퓨터, 나너우리, IYU-S25J9, Intel Core i5 12500(3.0GHz)","983500","983500","983500","983500","983500","1253500","1253500","0","2029.09.30"
"SAME","주식회사 대우루컴즈","25563999","데스크톱컴퓨터, 대우루컴즈, DT367B-446500, Intel Core i5 14400(2.5GHz)","984000","984000","984000","983500","983500","1205000","1205000","0","2029.09.30"
"SAME","주식회사 대우루컴즈","25563948","데스크톱컴퓨터, 대우루컴즈, DS367A-446500, Intel Core i5 14400(2.5GHz)","984000","984000","984000","984000","984000","1205000","1205000","0","2029.09.30"
"SAME","주식회사 에이텍컴퓨터","25569846","데스크톱컴퓨터, 에이텍컴퓨터, A4SQ-4NBDN, Intel Core i5 14400(2.5GHz)","984000","984000","984000","984000","984000","1205000","1205000","0","2029.09.30"
"SAME","주식회사 에이텍컴퓨터","25569908","데스크톱컴퓨터, 에이텍컴퓨터, A4TQ-4NBDN, Intel Core i5 14400(2.5GHz)","984000","984000","984000","984000","984000","1205000","1205000","0","2029.09.30"
"SAME","주식회사 기린","25001178","데스크톱컴퓨터, 기린, KR176-T3516310, Intel Core i5 13500(2.5GHz)","984500","984500","984500","984000","984000","1313500","1313500","0","2029.09.30"
"SAME","(주)유투","25479197","데스크톱컴퓨터, 유투, T5E2-520, Intel Core i5 14500(2.6GHz)","985000","985000","985000","984500","984500","1329100","1329100","0","2029.09.30"
"SAME","주식회사 기린","25320684","데스크톱컴퓨터, 기린, KR176-S35162C0, Intel Core i5-13500(2.5GHz)","986130","986130","986130","985000","985000","1270130","1270130","0","2029.09.30"
"UP","주식회사 주연테크","25792438","데스크톱컴퓨터, 주연테크, JA-144F1S, Intel Core i5-14400(2.5GHz)","986500","986500","986500","986500","986500","986500","1178500","192000","2029.09.30"
"UP","주식회사 주연테크","25792387","데스크톱컴퓨터, 주연테크, JS-144F1S, Intel Core i5-14400(2.5GHz)","986500","986500","986500","986130","986130","986500","1178500","192000","2029.09.30"
"SAME","주식회사 아이티에스","24814352","데스크톱컴퓨터, 아이티에스, ITS-DT12-G7C52, Intel Core i7 12700(2.1GHz)","987000","987000","987000","986500","986500","1443000","1443000","0","2028.02.12"
"SAME","주식회사 아이티에스","24814314","데스크톱컴퓨터, 아이티에스, ITS-DS12-G7C52, Intel Core i7 12700(2.1GHz)","987000","987000","987000","987000","987000","1443000","1443000","0","2028.02.12"
"SAME","주식회사 인텍","25319782","데스크톱컴퓨터, 인텍, IT176-T35323C0, Intel Core i5-13500(2.5GHz)","987000","987000","987000","987000","987000","1386000","1386000","0","2029.03.14"
"SAME","오렌지보호작업장","25613344","데스크톱컴퓨터, 오렌지보호작업장, OMR-44001, Intel Core i5 14400(2.5GHz)","988000","988000","988000","988000","987000","1300000","1300000","0","2029.09.30"
"SAME","오렌지보호작업장","25613331","데스크톱컴퓨터, 오렌지보호작업장, OSR-44001, Intel Core i5 14400(2.5GHz)","988000","988000","988000","987000","988000","1300000","1300000","0","2029.09.30"
"SAME","위더스컴퓨터 주식회사","24487402","데스크톱컴퓨터, 위더스컴퓨터, H6T-50N2H18-V30, Intel Core i5 12500(3.0GHz)","989000","989000","989000","988000","988000","1186000","1186000","0","2029.09.30"
"DOWN","주식회사 삼보컴퓨터","25569979","데스크톱컴퓨터, 삼보컴퓨터, DT281-GC31Q-003, Intel Core i3 14100(3.5GHz)","989000","989000","989000","989000","989000","1215000","1210000","-5000","2029.09.30"
"SAME","주식회사 대우루컴즈","25563944","데스크톱컴퓨터, 대우루컴즈, DS367A-416520, Intel Core i3 14100(3.5GHz)","989000","989000","989000","989000","989000","1210000","1210000","0","2029.09.30"
"SAME","주식회사 대우루컴즈","25564001","데스크톱컴퓨터, 대우루컴즈, DT367B-416520, Intel Core i3 14100(3.5GHz)","989000","989000","989000","989000","989000","1210000","1210000","0","2029.09.30"
"SAME","주식회사 에이텍컴퓨터","25569837","데스크톱컴퓨터, 에이텍컴퓨터, A4SQ-3NBDF, Intel Core i3-14100(3.5GHz)","989000","989000","","","","",,"0","2029.09.30"
"SAME","주식회사 에이텍컴퓨터","25569907","데스크톱컴퓨터, 에이텍컴퓨터, A4TQ-3NBDF, Intel Core i3 14100(3.5GHz)","989000","989000","","","","",,"0","2029.09.30"
"DOWN","주식회사 티원엘에스","25859217","데스크톱컴퓨터, 티원엘에스, TSB-771900M, AMD Ryzen7 7745(3.8GHz)","989900","989900","989900","989000","989000","989900","974900","-15000","2029.03.18"
"SAME","주식회사 비엔피","25085028","데스크톱컴퓨터, 비엔피, B5M-31T16S5HN, Intel Core i5 13500(2.5GHz)","990300","990300","990300","990300","990300","1239300","1239300","0","2029.09.30"
"SAME","주식회사 비엔피","25075293","데스크톱컴퓨터, 비엔피, B5S-31T16S5HN, Intel Core i5 13500(2.5GHz)","990300","990300","990300","989900","989900","1239300","1239300","0","2029.09.30"
"SAME","(주)유투","25034170","데스크톱컴퓨터, 유투, S5D2-510/B, Intel Core i5 13500(2.5GHz)","990500","990500","990500","990300","990500","1304100","1304100","0","2029.09.30"
"SAME","주식회사 코리","25673560","데스크톱컴퓨터, 코리, CR176-T4516220, Intel&nbsp;Core&nbsp;i5-14500(2.6GHz)","990800","990800","990800","990500","990500","1232800","1232800","0","2029.09.30"
"SAME","사단법인 한국사회적일자리개발원","24526171","데스크톱컴퓨터, 한국사회적일자리개발원, DT12-B516M20G0, Intel Core i5 12500(3.0GHz)","990900","990900","990900","990800","990800","1325000","1325000","0","2029.09.30"
"SAME","사단법인 한국사회적일자리개발원","24526143","데스크톱컴퓨터, 한국사회적일자리개발원, DT12-S516M20G0, Intel Core i5 12500(3.0GHz)","990900","990900","990900","990900","990900","1325000","1325000","0","2029.09.30"
"SAME","(주)유투","25479179","데스크톱컴퓨터, 유투, S5E2-520, Intel Core i5 14500(2.6GHz)","991000","991000","991000","991000","990900","1335100","1335100","0","2029.09.30"
"SAME","(주)유투","25479177","데스크톱컴퓨터, 유투, S4E2-520/B, Intel Core i5 14400(2.5GHz)","991000","991000","991000","991000","991000","1332800","1332800","0","2029.09.30"
"SAME","위더스컴퓨터 주식회사","24487409","데스크톱컴퓨터, 위더스컴퓨터, H6S-70N516, Intel Core i7 12700(2.1GHz)","991000","991000","991000","990900","991000","1264000","1264000","0","2029.09.30"
"SAME","주식회사 테트라","25356981","데스크톱컴퓨터, 테트라, T-MDT455S16, Intel Core i5 14500(2.6GHz)","991000","991000","991000","991000","991000","1176700","1176700","0","2029.09.30"
"SAME","주식회사 인텍","25234086","데스크톱컴퓨터, 인텍, IT176-T3516210, Intel Core i5-13500(2.5GHz)","991000","991000","991000","991000","991000","1381000","1381000","0","2029.03.14"
"SAME","(주)한성컴퓨터","25411625","데스크톱컴퓨터, 한성컴퓨터, T13-B573250V0, Intel Core i3 13100(3.4GHz)","991100","991100","991100","991000","991000","1333800","1333800","0","2027.08.08"
"DOWN","(주)레드스톤시스템","25618494","검색결과1,931건판매량순낮은가격순평점순최신등록순납품사례많은순","991500","991500","991500","991100","991100","1203500","1118500","-85000","2029.09.30"
"SAME","주식회사 티원엘에스","25859205","데스크톱컴퓨터, 티원엘에스, TSB-D51900S, Intel Core i5 14500(2.6GHz)","992100","992100","992100","991500","991500","1162600","1162600","0","2029.03.18"
"SAME","주식회사 기린","25661572","데스크톱컴퓨터, 기린, KR176-T4416220, Intel&nbsp;Core&nbsp;i5-14400(2.5GHz)","992500","992500","992500","992100","992100","1372500","1372500","0","2029.09.30"
"SAME","위더스컴퓨터 주식회사","24521186","데스크톱컴퓨터, 위더스컴퓨터, H6T-50N5H216, Intel Core i5 12500(3.0GHz)","993000","993000","993000","992500","993000","1322000","1322000","0","2029.09.30"
"DOWN","(주)레드스톤시스템","25618497","데스크톱컴퓨터, 레드스톤시스템, BMZ-7756HIKPFL, AMD Ryzen7 7700(3.8GHz)","993000","993000","993000","993000","992500","1181000","1111000","-70000","2029.09.30"
"SAME","주식회사 테트라","25088291","데스크톱컴퓨터, 테트라, T-DS351T5S16-P4VNO, Intel Core i5 13500(2.5GHz)","993300","993300","993300","993000","993000","1370100","1370100","0","2029.09.30"
"SAME","(주)한성컴퓨터","25803981","데스크톱컴퓨터, 한성컴퓨터, T14-B731651V0, Intel Core i3 14100(3.5GHz)","993500","993500","993500","993500","993300","1285900","1285900","0","2027.08.08"
"SAME","(주)한성컴퓨터","25803973","데스크톱컴퓨터, 한성컴퓨터, S14-B731651V0, Intel Core i3 14100(3.5GHz)","993500","993500","993500","993300","993500","1285900","1285900","0","2027.08.08"
"SAME","주식회사 기린","25001214","데스크톱컴퓨터, 기린, KR176-S3516320, Intel Core i5 13500(2.5GHz)","993700","993700","993700","993500","993500","1293700","1293700","0","2029.09.30"
"SAME","(주)유투","25479175","데스크톱컴퓨터, 유투, S5E2-500/B, Intel Core i5 14500(2.6GHz)","994000","994000","994000","993700","993700","1256800","1256800","0","2029.09.30"
"SAME","주식회사 아이브리지닷컴","25628972","데스크톱컴퓨터, 아이브리지닷컴, S5-X45B-1A2N, i5-14500(2.6GHz)","995000","995000","995000","994700","994700","1222000","1222000","0","2028.12.03"
"SAME","주식회사 비엔피","25031882","데스크톱컴퓨터, 비엔피, B5S-3T16S5H1, Intel Core i5 13500(2.5GHz)","995800","995800","995800","995000","995000","1261800","1261800","0","2029.09.30"
"SAME","주식회사 기린","25320688","데스크톱컴퓨터, 기린, KR176-T35162C0, Intel Core i5-13500(2.5GHz)","996130","996130","996130","995800","995800","1280130","1280130","0","2029.09.30"
"SAME","주식회사 성주컴텍","25231926","데스크톱컴퓨터, 성주컴텍, TD210-GRY76A0S1M, AMD Ryzen5 7600(3.8GHz)","996900","996900","996900","996130","996130","1344000","1344000","0","2029.09.30"
"SAME","주식회사 성주컴텍","25231916","데스크톱컴퓨터, 성주컴텍, SD110-GRY76A0S1M, AMD Ryzen5 7600(3.8GHz)","996900","996900","996900","996900","996900","1344000","1344000","0","2029.09.30"
"SAME","위더스컴퓨터 주식회사","24487413","데스크톱컴퓨터, 위더스컴퓨터, H6T-70N2H18, Intel Core i7 12700(2.1GHz)","997000","997000","997000","996900","996900","1165000","1165000","0","2029.09.30"
"SAME","위더스컴퓨터 주식회사","24487408","데스크톱컴퓨터, 위더스컴퓨터, H6S-70N2H18, Intel Core i7 12700(2.1GHz)","997000","997000","997000","997000","997000","1165000","1165000","0","2029.09.30"
"SAME","주식회사누리나루","25748069","데스크톱컴퓨터, 누리나루, NRM-315110, Intel Core i3-13100(3.4GHz)","997000","997000","997000","997000","997000","997000",,"0","2029.09.30"
"SAME","주식회사 티원엘에스","25916103","데스크톱컴퓨터, 티원엘에스, TMB-D11920, Intel Core i3 14100(3.5GHz)","997100","997100","997100","997000","997000","1100300","1100300","0","2029.03.18"
"DOWN","주식회사 티원엘에스","25859219","데스크톱컴퓨터, 티원엘에스, TMB-771900M, AMD Ryzen7 7745(3.8GHz)","997900","997900","997900","997100","997100","997900","949900","-48000","2029.03.18"
"SAME","(주)한성컴퓨터","24526226","데스크톱컴퓨터, 한성컴퓨터, T6-51651V0, Intel Core i5 12500(3.0GHz)","998000","998000","998000","997900","997900","1355300","1355300","0","2027.08.08"
"SAME","주식회사 엔와이컴퓨터","24964446","데스크톱컴퓨터, 엔와이컴퓨터, NY-C135SI00, Intel Core i5 13500(2.5GHz)","999700","999700","999700","998000","998000","1279200","1279200","0","2029.09.30"
"SAME","주식회사 아이티에스","25155332","데스크톱컴퓨터, 아이티에스, ITS-DS13-G7B50, Intel Core i7 13700(2.1GHz)","1001000","1001000","1001000","1001000","1001000","1350000","1350000","0","2028.02.12"
"SAME","주식회사 아이티에스","25155345","데스크톱컴퓨터, 아이티에스, ITS-DT13-G7B50, Intel Core i7 13700(2.1GHz)","1001000","1001000","1001000","999700","999700","1350000","1350000","0","2028.02.12"
"SAME","위메이드 보호작업장","25229317","데스크톱컴퓨터, 위메이드 보호작업장, RTM-L21M5VZ, Intel Core i5 13400(2.5GHz)","1001300","1001300","1001300","1001000","1001000","1261300","1261300","0","2026.07.19"
"SAME","위메이드 보호작업장","25229332","데스크톱컴퓨터, 위메이드 보호작업장, RTS-L21M5VZ, Intel Core i5 13400(2.5GHz)","1001300","1001300","1001300","1001300","1001300","1261300","1261300","0","2026.07.19"
"SAME","위메이드 보호작업장","25638693","데스크톱컴퓨터, 위메이드 보호작업장, RTM-421M5VZ, Intel Core i5 14400(2.5GHz)","1001500","1001500","1001500","1001300","1001300","1349500","1349500","0","2026.07.19"
"SAME","(주)한성컴퓨터","25110168","데스크톱컴퓨터, 한성컴퓨터, S7-A7821V0, AMD Ryzen 5 PRO 7645(3.8GHz)","1001600","1001600","1001600","1001500","1001500","1327500","1327500","0","2027.08.08"
"SAME","주식회사누리나루","25748057","데스크톱컴퓨터, 누리나루, NRM-415110, Intel Core i3-14100(3.5GHz)","1002000","1002000","1002000","1001600","1002000","1002000",,"0","2029.09.30"
"SAME","주식회사 삼보컴퓨터","25737588","데스크톱컴퓨터, 삼보컴퓨터, DT285-B770-002, AMD Ryzen7 7700(3.8GHz)","1002000","1002000","1002000","1002000","1002000","1217000","1217000","0","2029.09.30"
"SAME","주식회사 에이텍컴퓨터","25573216","데스크톱컴퓨터, 에이텍컴퓨터, A4SQ-5HBDN, Intel Core i5 14500(2.6GHz)","1002000","1002000","1002000","1002000","1001600","1223000","1223000","0","2029.09.30"
"SAME","주식회사 인텍","25319752","데스크톱컴퓨터, 인텍, IT176-S3516220, Intel Core i5-13500(2.5GHz)","1003500","","","","","",,"0","2029.03.14"
"SAME","(주)한성컴퓨터","25803974","데스크톱컴퓨터, 한성컴퓨터, S14-B741650V0, Intel Core i5 14400(2.5GHz)","1003600","1003600","1003600","1002000","1002000","1251600","1251600","0","2027.08.08"
"SAME","주식회사 기린","25309004","데스크톱컴퓨터, 기린, KR176-T3516320, Intel Core i5-13500(2.5GHz)","1003700","1003700","1003700","1003600","1003600","1303700","1303700","0","2029.09.30"
"SAME","주식회사누리나루","25748078","데스크톱컴퓨터, 누리나루, NRS-445120, Intel Core i5-14400(2.5GHz)","1004000","1004000","1004000","1004000","1004000","1004000",,"0","2029.09.30"
"SAME","주식회사 대우루컴즈","25770991","데스크톱컴퓨터, 대우루컴즈, DM46A-456200, Intel Core i5-14500(2.6GHz)","1004000","1004000","1004000","1003700","1003700","1191000","1191000","0","2029.09.30"
"UP","주식회사 서버앤컴퓨터","24589655","데스크톱컴퓨터, 서버앤컴퓨터, DODE-M7812, Intel Core i7 12700(2.1GHz)","1005000","1005000","1005000","1005000","1005000","1005000","1184200","179200","2026.04.29"
"DOWN","(주)레드스톤시스템","25618503","데스크톱컴퓨터, 레드스톤시스템, ASZ-7656HMP, AMD Ryzen5 7645(3.8GHz)","1005000","1005000","1005000","1004000","1004000","1260000","1134500","-125500","2029.09.30"
"SAME","사단법인 한국사회적일자리개발원","24526149","데스크톱컴퓨터, 한국사회적일자리개발원, DT12-S708M21G0, Intel Core i7 12700(2.1GHz)","1005800","1005800","1005800","1005800","1005800","1201100","1201100","0","2029.09.30"
"SAME","사단법인 한국사회적일자리개발원","24526178","데스크톱컴퓨터, 한국사회적일자리개발원, DT12-B708M21G0, Intel Core i7 12700(2.1GHz)","1005800","1005800","1005800","1005000","1005000","1201100","1201100","0","2029.09.30"
"UP","주식회사 서버앤컴퓨터","24158958","데스크톱컴퓨터, 서버앤컴퓨터, DECA-N7812, Intel Core i7 10700(2.9GHz)","1006000","1006000","1006000","1005800","1005800","1006000","1141500","135500","2026.04.29"
"DOWN","(주)다컴시스템","25586040","데스크톱컴퓨터, 다컴시스템, MI3DKD-4600BA, Intel Core i5 13500(2.5GHz)","1007000","1007000","1007000","1006000","1006000","1269000","1188000","-81000","2029.09.30"
"UP","주식회사 에이치케이시스템","25770754","데스크톱컴퓨터, 에이치케이시스템, HSB5-AX50P0, Intel Core i5 13500(2.5GHz)","1007200","1007200","1007200","1007200","1007200","1007200","1227700","220500","2029.09.30"
"UP","주식회사 에이치케이시스템","25769816","데스크톱컴퓨터, 에이치케이시스템, HTB5-AX50P0, Intel Core i5 13500(2.5GHz)","1007200","1007200","1007200","1007000","1007000","1007200","1227700","220500","2029.09.30"
"UP","주식회사 주연테크","25792437","데스크톱컴퓨터, 주연테크, JA-144G5S, Intel Core i5-14400(2.5GHz)","1007400","1007400","1007400","1007200","1007400","1007400","1426400","419000","2029.09.30"
"UP","주식회사 주연테크","25792386","데스크톱컴퓨터, 주연테크, JS-144G5S, Intel Core i5-14400(2.5GHz)","1007400","1007400","1007400","1007400","1007200","1007400","1426400","419000","2029.09.30"
"SAME","주식회사 인텍","25319781","데스크톱컴퓨터, 인텍, IT176-S35162C0, Intel Core i5-13500(2.5GHz)","1007500","1007500","1007500","1007400","1007400","1298500","1298500","0","2029.03.14"
"UP","주식회사 에이치케이시스템","25769814","데스크톱컴퓨터, 에이치케이시스템, HTB4-AX52P0, Intel Core i5 13400(2.5GHz)","1008900","1008900","1008900","1008000","1008000","1008900","1238200","229300","2029.09.30"
"UP","주식회사 서버앤컴퓨터","24589645","데스크톱컴퓨터, 서버앤컴퓨터, DODE-T51615, Intel Core i5 12500(3.0GHz)","1010000","1010000","1010000","1008900","1008900","1010000","1348700","338700","2026.04.29"
"DOWN","주식회사 삼보컴퓨터","25737227","데스크톱컴퓨터, 삼보컴퓨터, DM482-GC51-001, Intel Core i5 14500(2.6GHz)","1010000","1010000","1010000","1010000","1010000","1258000","1252000","-6000","2029.09.30"
"SAME","위더스컴퓨터 주식회사","25695810","데스크톱컴퓨터, 위더스컴퓨터, B7S-450N516, Intel Core i5 14500(2.6GHz)","1010100","1010100","1010100","1010000","1010000","1338000","1338000","0","2029.09.30"
"SAME","주식회사 티원엘에스","25855500","데스크톱컴퓨터, 티원엘에스, TMB-D51900S, Intel Core i5 14500(2.6GHz)","1010100","1010100","1010100","1010100","1010100","1180600","1180600","0","2029.03.18"
"SAME","주식회사 테트라","25356975","데스크톱컴퓨터, 테트라, T-KMDT455S8, Intel Core i5 14500(2.6GHz)","1011800","1011800","1011800","1010100","1010100","1167300","1167300","0","2029.09.30"
"SAME","주식회사 스마트인디지털","24502761","데스크톱컴퓨터, 스마트인디지털, DLM5-PGBSAT(103), Intel Core i5 12500(3GHz)","1012000","1012000","1012000","1011800","1011800","1341200","1341200","0","2029.09.30"
"SAME","주식회사 기린","24481713","데스크톱컴퓨터, 기린, KR161-T2716310, Intel Core i7 12700(2.1GHz)","1012100","1012100","1012100","1012000","1012000","1344100","1344100","0","2029.09.30"
"SAME","(주)한성컴퓨터","25110178","데스크톱컴퓨터, 한성컴퓨터, T7-A61650V0, AMD Ryzen 5 PRO 7645(3.8GHz)","1012800","1012800","1012800","1012100","1012100","1356300","1356300","0","2027.08.08"
"SAME","주식회사 테트라","24890375","데스크톱컴퓨터, 테트라, T-MDT351T5S16, Intel Core i5 13500(2.5GHz)","1013000","1013000","1013000","1012800","1012800","1194900","1194900","0","2029.09.30"
"SAME","주식회사 인텍","25319767","데스크톱컴퓨터, 인텍, IT176-T3516220, Intel Core i5-13500(2.5GHz)","1013500","","","","","",,"0","2029.03.14"
"SAME","위더스컴퓨터 주식회사","25695803","데스크톱컴퓨터, 위더스컴퓨터, B7T-450N516, Intel Core i5 14500(2.6GHz)","1014100","1014100","1014100","1013000","1013000","1342000","1342000","0","2029.09.30"
"SAME","사단법인 한국사회적일자리개발원","24526168","검색결과1,931건판매량순낮은가격순평점순최신등록순납품사례많은순","1015400","1015400","1015400","1014100","1014100","1264500","1264500","0","2029.09.30"
"UP","주식회사 컴피그","25593569","데스크톱컴퓨터, 컴피그, CMI-7B2M0, Intel Core i7 14700(2.1GHz)","1015560","1015560","1015560","1015400","1015400","1015560","1313740","298180","2029.09.30"
"SAME","주식회사 비엔피","24663391","데스크톱컴퓨터, 비엔피, B5S-2T8S2H1, Intel Core i5 12500(3.0GHz)","1016700","1016700","1016700","1015560","1015560","1262700","1262700","0","2029.09.30"
"UP","주식회사 에이치케이시스템","25770774","데스크톱컴퓨터, 에이치케이시스템, HSC4-BX50P0, Intel Core i5 14400(2.5GHz)","1017000","1017000","1017000","1016700","1016700","1017000","1311200","294200","2029.09.30"
"UP","주식회사 에이치케이시스템","25769836","데스크톱컴퓨터, 에이치케이시스템, HTC4-BX50P0, Intel Core i5 14400(2.5GHz)","1017000","1017000","1017000","1017000","1017000","1017000","1311200","294200","2029.09.30"
"SAME","주식회사 코리","25673565","데스크톱컴퓨터, 코리, CR176-S4516320, Intel&nbsp;Core&nbsp;i5-14500(2.6GHz)","1017500","1017500","1017500","1017000","1017000","1272500","1272500","0","2029.09.30"
"SAME","주식회사 인텍","25319783","데스크톱컴퓨터, 인텍, IT176-T35162C0, Intel Core i5-13500(2.5GHz)","1017500","1017500","1017500","1017500","1017500","1308500","1308500","0","2029.03.14"
"SAME","(주)유투","25563638","데스크톱컴퓨터, 유투, T5E2-500/F, Intel Core i5 14500(2.6GHz)","1018000","1018000","1018000","1017500","1017500","1280800",,"0","2029.09.30"
"SAME","주식회사 스마트인디지털","25653031","데스크톱컴퓨터, 스마트인디지털, SLM5-PGESBT, Intel Core i5-14500(2.6GHz)","1019500","1019500","1019500","1018000","1018000","1330200","1330200","0","2029.09.30"
"SAME","주식회사 티원엘에스","25859223","데스크톱컴퓨터, 티원엘에스, TMB-D51900N, Intel Core i5 14500(2.6GHz)","1020100","1020100","1020100","1019500","1019500","1190600","1190600","0","2029.03.18"
