"UP","주식회사 인비전","25738651","데스크톱컴퓨터, 인비전, IV-M755165S1, Intel Core i5 14500(2.6GHz)","1116000","1116000","1116000","1116000","1116000","1116000","1387600","271600","2029.09.30"
"SAME","(주)다컴시스템","25586028","데스크톱컴퓨터, 다컴시스템, MI4DKD-4640BA, Intel Core i5 14500(2.6GHz)","1117000","1117000","1117000","1117000","1116000","1399000","1399000","0","2029.09.30"
"SAME","(주)다컴시스템","25586034","데스크톱컴퓨터, 다컴시스템, SI4DKM-4640BA, Intel Core i5 14500(2.6GHz)","1117000","1117000","1117000","1116000","1117000","1399000","1399000","0","2029.09.30"
"SAME","오렌지보호작업장","25613332","데스크톱컴퓨터, 오렌지보호작업장, OSR-45001, Intel Core i5 14500(2.6GHz)","1118000","1118000","1118000","1118000","1117000","1383000","1383000","0","2029.09.30"
"SAME","오렌지보호작업장","25613346","데스크톱컴퓨터, 오렌지보호작업장, OMR-45001, Intel Core i5 14500(2.6GHz)","1118000","1118000","1118000","1117000","1118000","1383000","1383000","0","2029.09.30"
"SAME","주식회사 엔와이컴퓨터","25554364","데스크톱컴퓨터, 엔와이컴퓨터, NY-E147SI00, Intel Core i7 14700(2.1GHz)","1119700","1119700","1119700","1118000","1118000","1396700","1396700","0","2029.09.30"
"SAME","주식회사 아이티에스","25155335","데스크톱컴퓨터, 아이티에스, ITS-DS13-G7C51, Intel Core i7 13700(2.1GHz)","1120000","1120000","1120000","1120000","1120000","1590000","1590000","0","2028.02.12"
"SAME","주식회사 아이티에스","25155353","데스크톱컴퓨터, 아이티에스, ITS-DT13-G7C51, Intel Core i7 13700(2.1GHz)","1120000","1120000","1120000","1119700","1119700","1590000","1590000","0","2028.02.12"
"UP","주식회사 주연테크","25792425","데스크톱컴퓨터, 주연테크, JA-147F5S, Intel Core i7-14700(2.1GHz)","1121900","1121900","1121900","1121900","1120000","1121900","1335900","214000","2029.09.30"
"UP","주식회사 주연테크","25694262","데스크톱컴퓨터, 주연테크, JS-U5F5S, Intel Core Ultra 5 245K(4.2GHz)","1121900","1121900","1121900","1121900","1121900","1121900","1335900","214000","2029.09.30"
"UP","주식회사 주연테크","25792373","데스크톱컴퓨터, 주연테크, JS-147F5S, Intel Core i7-14700(2.1GHz)","1121900","1121900","1121900","1121900","1121900","1121900","1335900","214000","2029.09.30"
"UP","주식회사 주연테크","25694232","데스크톱컴퓨터, 주연테크, JA-U5F5S, Intel Core Ultra 5 245K(4.2GHz)","1121900","1121900","1121900","1120000","1121900","1121900","1335900","214000","2029.09.30"
"UP","주식회사 에이치케이시스템","25770763","데스크톱컴퓨터, 에이치케이시스템, HSB5-BX52P0, Intel Core i5 14500(2.6GHz)","1122200","1122200","1122200","1121900","1121900","1122200","1377400","255200","2029.09.30"
"UP","주식회사 에이치케이시스템","25769821","데스크톱컴퓨터, 에이치케이시스템, HTB5-BX52P0, Intel Core i5 14500(2.6GHz)","1122200","1122200","1122200","1122200","1122200","1122200","1377400","255200","2029.09.30"
"NEW","주식회사 트리엠","25726663","데스크톱컴퓨터, 트리엠, TX4-RH7-506, Intel Core i7-14700(2.1GHz)","1122900","","","","","","1428400","0","2029.06.25"
"SAME","주식회사 인텍","25822915","데스크톱컴퓨터, 인텍, ITA176-T45324C0, IntelCore i5-14500(2.6GHz)","1123000","1123000","1123000","1122200","1122200","1574000","1574000","0","2029.03.14"
"SAME","주식회사 티원엘에스","25855498","데스크톱컴퓨터, 티원엘에스, TMB-D51920S, Intel Core i5 14500(2.6GHz)","1124100","1124100","1124100","1123000","1123000","1294600","1294600","0","2029.03.18"
"SAME","몬스타주식회사","25493399","데스크톱컴퓨터, 몬스타, MPC-S145R16S256H1, Intel Core i5 14500(5.0GHz)","1126320","1126320","1126320","1124100","1124100","1468820","1468820","0","2027.08.24"
"SAME","주식회사 아이브리지닷컴","25628974","데스크톱컴퓨터, 아이브리지닷컴, S7-X47B-1A2N, i7-14700(2.1GHz)","1127000","1127000","1127000","1126320","1126320","1376000","1376000","0","2028.12.03"
"SAME","주식회사 기린","25661579","데스크톱컴퓨터, 기린, KR176-S4516320, Intel&nbsp;Core&nbsp;i5-14500(2.6GHz)","1127200","1127200","1127200","1127000","1127000","1468200","1468200","0","2029.09.30"
"SAME","주식회사 테트라","24954992","데스크톱컴퓨터, 테트라, T-DT351T5S16-P8V7, Intel Core i5 13500(2.1GHz)","1127300","1127300","1127300","1127200","1127200","1504100","1504100","0","2029.09.30"
"SAME","주식회사누리나루","25748074","데스크톱컴퓨터, 누리나루, NRS-451020, Intel Core i5-14500(2.6GHz)","1127400","1127400","1127400","1127300","1127300","1127400",,"0","2029.09.30"
"DOWN","(주)레드스톤시스템","25618451","데스크톱컴퓨터, 레드스톤시스템, DMY-4566HHKP, Intel Core i5 14500(2.6GHz)","1128000","1128000","1128000","1128000","1128000","1455000","1371000","-84000","2029.09.30"
"DOWN","(주)레드스톤시스템","25618478","데스크톱컴퓨터, 레드스톤시스템, CSY-4566HHKP, Intel Core i5 14500(2.6GHz)","1128000","1128000","1128000","1128000","1128000","1455000","1367000","-88000","2029.09.30"
"DOWN","(주)레드스톤시스템","25618466","데스크톱컴퓨터, 레드스톤시스템, CSY-4566HHKPL, Intel Core i5 14500(2.6GHz)","1128000","1128000","1128000","1128000","1128000","1455000","1405000","-50000","2029.09.30"
"DOWN","(주)레드스톤시스템","25618951","데스크톱컴퓨터, 레드스톤시스템, DMY-4566HHKPL, Intel Core i5 14500(2.6GHz)","1128000","1128000","1128000","1127400","1127400","1455000","1323000","-132000","2029.09.30"
"DOWN","주식회사 삼보컴퓨터","25569991","데스크톱컴퓨터, 삼보컴퓨터, DT281-GC51Q-004, Intel Core i5 14500(2.6GHz)","1129000","1129000","1129000","1128000","1128000","1543000","1538000","-5000","2029.09.30"
"UP","(주)컴트리","25797478","데스크톱컴퓨터, 컴트리, CS4-E71-B0001, Intel Core i7 14700(2.1GHz)","1129410","1129410","1129410","1129000","1129000","1129410","1484710","355300","2029.09.30"
"SAME","주식회사 테트라","25356970","데스크톱컴퓨터, 테트라, T-KMDT475S16, Intel Core i7 14700(2.1GHz)","1129700","1129700","1129700","1129410","1129410","1349000","1349000","0","2029.09.30"
"UP","(주)컴트리","25797469","데스크톱컴퓨터, 컴트리, CM4-E71-B0002, Intel Core i7 14700(2.1GHz)","1129710","1129710","1129710","1129700","1129700","1129710","1463310","333600","2029.09.30"
"UP","주식회사 서버앤컴퓨터","24589660","검색결과1,931건판매량순낮은가격순평점순최신등록순납품사례많은순","1130000","1130000","1130000","1129710","1129710","1130000","1426700","296700","2026.04.29"
"DOWN","(주)레드스톤시스템","25618481","데스크톱컴퓨터, 레드스톤시스템, CSY-4566HMP, Intel Core i5 14500(2.6GHz)","1130500","1130500","1130500","1130500","1130500","1412500","1324500","-88000","2029.09.30"
"DOWN","(주)레드스톤시스템","25618454","데스크톱컴퓨터, 레드스톤시스템, DMY-4566HMP, Intel Core i5 14500(2.6GHz)","1130500","1130500","1130500","1130500","1130500","1412500","1328500","-84000","2029.09.30"
"DOWN","(주)레드스톤시스템","25618954","데스크톱컴퓨터, 레드스톤시스템, DMY-4566HMPL, Intel Core i5 14500(2.6GHz)","1130500","1130500","1130500","1130000","1130000","1412500","1280500","-132000","2029.09.30"
"SAME","(주)유투","25769643","데스크톱컴퓨터, 유투, AT5E2-500/B, AMD Ryzen5 PRO 7645(3.8GHz)","1131000","1131000","1131000","1131000","1131000","1326700","1326700","0","2029.09.30"
"UP","주식회사 인비전","25738647","데스크톱컴퓨터, 인비전, IV-M754165S1H2, Intel Core i5 14400(2.5GHz)","1131000","1131000","1131000","1130500","1130500","1131000","1491900","360900","2029.09.30"
"SAME","주식회사 비엔피","24663389","데스크톱컴퓨터, 비엔피, B5S-2T16S5H1, Intel Core i5 12500(3.0GHz)","1132900","1132900","1132900","1131000","1131000","1575900","1575900","0","2029.09.30"
"SAME","주식회사 비엔피","24663400","데스크톱컴퓨터, 비엔피, B5M-2T16S5H1, Intel Core i5 12500(3.0GHz)","1132900","1132900","1132900","1132900","1132900","1575900","1575900","0","2029.09.30"
"SAME","주식회사 엔와이컴퓨터","25558756","데스크톱컴퓨터, 엔와이컴퓨터, NY-E144QIB00, Intel Core i5 14400(2.5GHz)","1134000","1134000","1134000","1132900","1132900","1533900","1533900","0","2029.09.30"
"SAME","주식회사 엔와이컴퓨터","25558773","데스크톱컴퓨터, 엔와이컴퓨터, NY-P144QIB00, Intel Core i5 14400(2.5GHz)","1134000","1134000","1134000","1134000","1134000","1533900","1533900","0","2029.09.30"
"SAME","사단법인 한국사회적일자리개발원","24526188","데스크톱컴퓨터, 한국사회적일자리개발원, DT12-B732M50G0, Intel Core i7 12700(2.1GHz)","1134000","1134000","1134000","1134000","1134000","1674200","1674200","0","2029.09.30"
"SAME","주식회사 티원엘에스","25859226","데스크톱컴퓨터, 티원엘에스, TSB-D51920N, Intel Core i5 14500(2.6GHz)","1134100","1134100","1134100","1134000","1134000","1304600","1304600","0","2029.03.18"
"SAME","주식회사 티원엘에스","25859222","데스크톱컴퓨터, 티원엘에스, TMB-D51920N, Intel Core i5 14500(2.6GHz)","1134100","1134100","1134100","1134100","1134100","1304600","1304600","0","2029.03.18"
"SAME","주식회사 메이커스테크놀로지","25708421","데스크톱컴퓨터, 메이커스테크놀로지, D12505H116V5, Intel Core i5 12500(2.1GHz)","1135600","1135600","1135600","1134100","1134100","1402800","1402800","0","2029.09.30"
"SAME","위더스컴퓨터 주식회사","24521195","데스크톱컴퓨터, 위더스컴퓨터, H6T-70N2H116-V30, Intel Core i7 12700(2.1GHz)","1136000","1136000","1136000","1135600","1135600","1419000","1419000","0","2029.09.30"
"UP","주식회사 서버앤컴퓨터","24589654","데스크톱컴퓨터, 서버앤컴퓨터, DODE-T716210, Intel Core i7 12700(2.1GHz)","1137000","1137000","1137000","1136000","1136000","1137000","1411800","274800","2026.04.29"
"SAME","주식회사 기린","25661568","데스크톱컴퓨터, 기린, KR176-T4516320, Intel&nbsp;Core&nbsp;i5-14500(2.6GHz)","1137200","1137200","1137200","1137000","1137000","1478200","1478200","0","2029.09.30"
"DOWN","주식회사 삼보컴퓨터","25569925","데스크톱컴퓨터, 삼보컴퓨터, DG481-GB51Q-003, Intel Core i5 13500(2.5GHz)","1138000","1138000","1138000","1138000","1138000","1364000","1359000","-5000","2029.09.30"
"DOWN","주식회사 삼보컴퓨터","25569966","데스크톱컴퓨터, 삼보컴퓨터, DT281-GB51Q-003, Intel Core i5 13500(2.5GHz)","1138000","1138000","1138000","1138000","1138000","1364000","1359000","-5000","2029.09.30"
"SAME","주식회사 대우루컴즈","25563899","데스크톱컴퓨터, 대우루컴즈, DT367B-356520, Intel Core i5 13500(2.5GHz)","1138000","1138000","1138000","1138000","1138000","1359000","1359000","0","2029.09.30"
"SAME","주식회사 대우루컴즈","25563925","데스크톱컴퓨터, 대우루컴즈, DS367A-356520, Intel Core i5 13500(2.5GHz)","1138000","1138000","1138000","1137200","1137200","1359000","1359000","0","2029.09.30"
"SAME","주식회사 에이텍컴퓨터","25569887","데스크톱컴퓨터, 에이텍컴퓨터, A3TQ-5NBDF, Intel Core i5 13500(2.5GHz)","1138000","1138000","1138000","1138000","1138000","1359000","1359000","0","2029.09.30"
"SAME","주식회사 에이텍컴퓨터","25569829","데스크톱컴퓨터, 에이텍컴퓨터, A3SQ-5NBDF, Intel Core i5 13500(2.5GHz)","1138000","1138000","1138000","1138000","1138000","1359000","1359000","0","2029.09.30"
"SAME","주식회사 티원엘에스","25855491","데스크톱컴퓨터, 티원엘에스, TMB-D71900S, Intel Core i7 14700(2.1GHz)","1138100","1138100","1138100","1138000","1138000","1350200","1350200","0","2029.03.18"
"SAME","(주)유투","25563637","데스크톱컴퓨터, 유투, S5E2-520/F, Intel Core i5 14500(2.6GHz)","1139000","1139000","1139000","1138100","1138100","1429000",,"0","2029.09.30"
"UP","주식회사 주연테크","25792385","데스크톱컴퓨터, 주연테크, JS-144G5S1S, Intel Core i5-14400(2.5GHz)","1139500","1139500","1139500","1139000","1139500","1139500","1595500","456000","2029.09.30"
"UP","주식회사 주연테크","25792435","데스크톱컴퓨터, 주연테크, JA-144G5S1S, Intel Core i5-14400(2.5GHz)","1139500","1139500","1139500","1139500","1139000","1139500","1595500","456000","2029.09.30"
"SAME","(주)유투","25545871","데스크톱컴퓨터, 유투, T7E2-220, Intel Core i7 14700(2.1GHz)","1140000","1140000","1140000","1139500","1139500","1486800","1486800","0","2029.09.30"
"SAME","위더스컴퓨터 주식회사","25779565","데스크톱컴퓨터, 위더스컴퓨터, B8L-55N516, Intel Core Ultra 5 235(3.4GHz)","1141000","1141000","1141000","1140000","1140000","1307000","1307000","0","2029.09.30"
"SAME","주식회사 테트라","24890371","데스크톱컴퓨터, 테트라, T-MDT372T5S16, Intel Core i7 13700(2.1GHz)","1141700","1141700","1141700","1141000","1141000","1371800","1371800","0","2029.09.30"
"UP","주식회사 에이치케이시스템","25769826","데스크톱컴퓨터, 에이치케이시스템, HTB7-AX50P0, Intel Core i7 13700(2.1GHz)","1141800","1141800","1141800","1141800","1141800","1141800","1405300","263500","2029.09.30"
"UP","주식회사 에이치케이시스템","25770756","데스크톱컴퓨터, 에이치케이시스템, HSB7-AX50P0, Intel Core i7 13700(2.1GHz)","1141800","1141800","1141800","1141700","1141700","1141800","1405300","263500","2029.09.30"
"SAME","주식회사 삼보컴퓨터","25569955","데스크톱컴퓨터, 삼보컴퓨터, DT281-GB31Q-001, Intel Core i5 13500(2.5GHz)","1142000","1142000","","","","",,"0","2029.09.30"
"SAME","주식회사 코리","25673564","데스크톱컴퓨터, 코리, CR176-T4716320, Intel&nbsp;Core&nbsp;i7-14700(2.6GHz)","1142500","1142500","1142500","1142000","1142000","1424500","1424500","0","2029.09.30"
"SAME","주식회사 대우루컴즈","25563951","데스크톱컴퓨터, 대우루컴즈, DS367A-4465C0, Intel Core i5 14400(2.5GHz)","1144000","1144000","1144000","1142500","1142500","1403000","1403000","0","2029.09.30"
"SAME","주식회사 대우루컴즈","25563991","데스크톱컴퓨터, 대우루컴즈, DT367B-4465C0, Intel Core i5 14400(2.5GHz)","1144000","1144000","1144000","1144000","1144000","1403000","1403000","0","2029.09.30"
"SAME","주식회사 에이텍컴퓨터","25569909","데스크톱컴퓨터, 에이텍컴퓨터, A4TQ-4NBJN, Intel Core i5 14400(2.5GHz)","1144000","1144000","1144000","1144000","1144000","1403000","1403000","0","2029.09.30"
"SAME","주식회사 에이텍컴퓨터","25569856","데스크톱컴퓨터, 에이텍컴퓨터, A4SQ-4NBJN, Intel Core i5 14400(2.5GHz)","1144000","1144000","","","","",,"0","2029.09.30"
"UP","네오프랜드(주)","24645796","데스크톱컴퓨터, 네오프랜드, NDI52M2-C22N, Intel Core i5 12500(3.0GHz)","1144540","1144540","1144540","1144000","1144000","1144540","1625020","480480","2026.08.03"
"SAME","(주)한성컴퓨터","25110159","데스크톱컴퓨터, 한성컴퓨터, S13-B773221V0, Intel Core i5 13500(2.5GHz)","1144800","1144800","1144800","1144800","1144800","1516100","1516100","0","2027.08.08"
"SAME","(주)한성컴퓨터","25110166","데스크톱컴퓨터, 한성컴퓨터, T13-X773221V0, Intel Core i5 13500(2.5GHz)","1144800","1144800","1144800","1144540","1144540","1516100","1516100","0","2027.08.08"
"SAME","(주)유투","25479187","데스크톱컴퓨터, 유투, T7E2-500/B, Intel Core i7 14700(2.1GHz)","1145000","1145000","1145000","1144800","1144800","1445500","1445500","0","2029.09.30"
"UP","주식회사 에이치케이시스템","25770767","데스크톱컴퓨터, 에이치케이시스템, HSB5-BY50P0, Intel Core i5 14500(2.6GHz)","1146000","1146000","1146000","1145000","1145000","1146000","1601200","455200","2029.09.30"
"SAME","몬스타주식회사","25493398","데스크톱컴퓨터, 몬스타, MPC-M145R16S256H1, Intel Core i5 14500(5.0GHz)","1146320","1146320","1146320","1146000","1146000","1488820","1488820","0","2027.08.24"
"NEW","주식회사 트리엠","25726661","데스크톱컴퓨터, 트리엠, TX4-CH7-506, Intel Core i7-14700(2.1GHz)","1146900","","","","","","1452400","0","2029.06.25"
"SAME","주식회사 기린","25661580","데스크톱컴퓨터, 기린, KR176-S4716300, Intel&nbsp;Core&nbsp;i7-14700(2.1GHz)","1147500","1147500","1147500","1147500","1146320","1488500","1488500","0","2029.09.30"
"SAME","위더스컴퓨터 주식회사","24935046","검색결과1,931건판매량순낮은가격순평점순최신등록순납품사례많은순","1148000","1148000","1148000","1147500","1148000","1480000","1480000","0","2029.09.30"
"SAME","주식회사 아이티에스","25155349","데스크톱컴퓨터, 아이티에스, ITS-DT13-G7C52, Intel Core i7 13700(2.1GHz)","1148000","1148000","1148000","1148000","1148000","1628000","1628000","0","2028.02.12"
"SAME","주식회사 티원엘에스","25859220","데스크톱컴퓨터, 티원엘에스, TMB-D71900N, Intel Core i7 14700(2.1GHz)","1148100","1148100","1148100","1148100","1148100","1360200","1360200","0","2029.03.18"
"SAME","주식회사 티원엘에스","25859225","데스크톱컴퓨터, 티원엘에스, TSB-D71900N, Intel Core i7 14700(2.1GHz)","1148100","1148100","1148100","1148000","1148000","1360200","1360200","0","2029.03.18"
"SAME","(주)유투","26023421","데스크톱컴퓨터, 유투, LS5E2-520/B, Intel Core i5 14500(2.6GHz)","1149000","1149000","1149000","1148100","1148100","1439000","1439000","0","2029.09.30"
"SAME","위메이드 보호작업장","25638696","데스크톱컴퓨터, 위메이드 보호작업장, RTM-F2ZM55VZ, Intel Core i5 14500(2.6GHz)","1150200","1150200","1150200","1149000","1149000","1488900","1488900","0","2026.07.19"
"SAME","위메이드 보호작업장","25638690","데스크톱컴퓨터, 위메이드 보호작업장, RTS-F2ZM55VZ, Intel Core i5 14500(2.6GHz)","1150200","1150200","1150200","1150200","1150200","1488900","1488900","0","2026.07.19"
"UP","(주)컴트리","25797445","데스크톱컴퓨터, 컴트리, CM4-E51-Q0001, Intel Core i5 14500(2.6GHz)","1151610","1151610","1151610","1150200","1150200","1151610","1456810","305200","2029.09.30"
"SAME","위메이드 보호작업장","25638713","데스크톱컴퓨터, 위메이드 보호작업장, RTS-F22M56VZ, Intel Core i5 14500(2.6GHz)","1151700","1151700","1151700","1151700","1151700","1456600","1456600","0","2026.07.19"
"SAME","위메이드 보호작업장","25638698","데스크톱컴퓨터, 위메이드 보호작업장, RTM-F22M56VZ, Intel Core i5 14500(2.6GHz)","1151700","1151700","1151700","1151610","1151610","1456600","1456600","0","2026.07.19"
"NEW","주식회사 트리엠","25726665","데스크톱컴퓨터, 트리엠, TX4-RB7-5506, Intel Core i7-14700(2.1GHz)","1151900","","","","","","1511400","0","2029.06.25"
"SAME","주식회사 비엔피","24663408","데스크톱컴퓨터, 비엔피, B7M-2T16S5H1, Intel Core i7 12700(2.1GHz)","1154500","1154500","1154500","1151700","1151700","1543500","1543500","0","2029.09.30"
"SAME","주식회사 테트라","25356972","데스크톱컴퓨터, 테트라, T-KMDT452T5S16, Intel Core i5 14500(2.6GHz)","1155200","1155200","1155200","1154500","1154500","1348400","1348400","0","2029.09.30"
"SAME","주식회사 기린","25661581","데스크톱컴퓨터, 기린, KR176-S4532300, Intel&nbsp;Core&nbsp;i5-14500(2.6GHz)","1157430","1157430","1157430","1155200","1155200","1656430","1656430","0","2029.09.30"
"SAME","주식회사 기린","25661569","데스크톱컴퓨터, 기린, KR176-T4716300, Intel&nbsp;Core&nbsp;i7-14700(2.1GHz)","1157500","1157500","1157500","1157430","1157430","1498500","1498500","0","2029.09.30"
"SAME","주식회사 인텍","25319772","데스크톱컴퓨터, 인텍, IT176-T3716220, Intel Core i7-13700(2.1GHz)","1157700","","","","","",,"0","2029.03.14"
"SAME","오렌지보호작업장","25613336","데스크톱컴퓨터, 오렌지보호작업장, OMG-45001, Intel Core i5 14500(2.6GHz)","1158000","1158000","1158000","1158000","1158000","1423000","1423000","0","2029.09.30"
"SAME","오렌지보호작업장","25613326","데스크톱컴퓨터, 오렌지보호작업장, OSG-45001, Intel Core i5 14500(2.6GHz)","1158000","1158000","1158000","1158000","1158000","1423000","1423000","0","2029.09.30"
"DOWN","주식회사 삼보컴퓨터","25569990","데스크톱컴퓨터, 삼보컴퓨터, DT281-GC51Q-003, Intel Core i5 14500(2.6GHz)","1158000","1158000","1158000","1158000","1158000","1384000","1379000","-5000","2029.09.30"
"DOWN","주식회사 삼보컴퓨터","25569945","데스크톱컴퓨터, 삼보컴퓨터, DG481-GC51Q-003, Intel Core i5 14500(2.6GHz)","1158000","1158000","1158000","1158000","1158000","1384000","1379000","-5000","2029.09.30"
"SAME","주식회사 대우루컴즈","25563997","데스크톱컴퓨터, 대우루컴즈, DT367B-456520, Intel Core i5 14500(2.6GHz)","1158000","1158000","1158000","1157500","1157500","1379000","1379000","0","2029.09.30"
"SAME","주식회사 대우루컴즈","25563970","데스크톱컴퓨터, 대우루컴즈, DS367A-456520, Intel Core i5 14500(2.6GHz)","1158000","1158000","1158000","1158000","1158000","1379000","1379000","0","2029.09.30"
"SAME","주식회사 에이텍컴퓨터","25569851","데스크톱컴퓨터, 에이텍컴퓨터, A4SQ-5NBDF, Intel Core i5 14500(2.6GHz)","1158000","1158000","1158000","1158000","1158000","1379000","1379000","0","2029.09.30"
"SAME","주식회사 에이텍컴퓨터","25569905","데스크톱컴퓨터, 에이텍컴퓨터, A4TQ-5NBDF, Intel Core i5 14500(2.6GHz)","1158000","1158000","1158000","1158000","1158000","1379000","1379000","0","2029.09.30"
"SAME","사단법인 나너우리","25785859","데스크톱컴퓨터, 나너우리, IYU-S471J9, Intel Core i7 14700(2.1GHz)","1158500","1158500","1158500","1158000","1158000","1483500","1483500","0","2029.09.30"
"SAME","사단법인 나너우리","25784881","데스크톱컴퓨터, 나너우리, IYU-M471J9, Intel Core i7 14700(2.1GHz)","1158500","1158500","1158500","1158500","1158500","1483500","1483500","0","2029.09.30"
"SAME","주식회사 아이티에스","25155344","데스크톱컴퓨터, 아이티에스, ITS-DT13-G5B51V5, Intel Core i5 13500(2.5GHz)","1160000","1160000","1160000","1158500","1158500","1550000","1550000","0","2028.02.12"
"SAME","(주)다컴시스템","25586033","데스크톱컴퓨터, 다컴시스템, SI4FKM-4600BA, Intel Core i7 14700(2.1GHz)","1161000","1161000","1161000","1161000","1161000","1460000","1460000","0","2029.09.30"
"SAME","(주)다컴시스템","25586027","데스크톱컴퓨터, 다컴시스템, MI4FKD-4600BA, Intel Core i7 14700(2.1GHz)","1161000","1161000","1161000","1160000","1160000","1460000","1460000","0","2029.09.30"
"SAME","(주)유투","25545869","데스크톱컴퓨터, 유투, T7E2-520, Intel Core i7 14700(2.1GHz)","1162000","1162000","1162000","1162000","1162000","1543800","1543800","0","2029.09.30"
"DOWN","(주)레드스톤시스템","25618460","데스크톱컴퓨터, 레드스톤시스템, DMY-4566HHKPF, Intel Core i5 14500(2.6GHz)","1162000","1162000","1162000","1162000","1162000","1489000","1439000","-50000","2029.09.30"
"DOWN","(주)레드스톤시스템","25618485","데스크톱컴퓨터, 레드스톤시스템, CSY-4566HHKPF, Intel Core i5 14500(2.6GHz)","1162000","1162000","1162000","1162000","1162000","1489000","1439000","-50000","2029.09.30"
"UP","주식회사 주연테크","25792427","데스크톱컴퓨터, 주연테크, JA-145G5S2H, Intel Core i5-14500(2.6GHz)","1162200","1162200","1162200","1162000","1162000","1162200","1616200","454000","2029.09.30"
"SAME","사단법인 나너우리","25784887","데스크톱컴퓨터, 나너우리, IYU-S451N9, Intel Core i5 14500(2.6GHz)","1162500","1162500","1162500","1162200","1162200","1507500","1507500","0","2029.09.30"
"SAME","사단법인 나너우리","25784876","데스크톱컴퓨터, 나너우리, IYU-M451N9, Intel Core i5 14500(2.6GHz)","1162500","1162500","1162500","1162500","1162500","1507500","1507500","0","2029.09.30"
"SAME","주식회사 비엔피","25031940","데스크톱컴퓨터, 비엔피, B7M-3T16S5H1, Intel Core i7 13700(2.1GHz)","1163300","1163300","1163300","1162500","1162500","1462300","1462300","0","2029.09.30"
"DOWN","(주)레드스톤시스템","25618488","데스크톱컴퓨터, 레드스톤시스템, CSY-4566HMPF, Intel Core i5 14500(2.6GHz)","1164500","1164500","1164500","1164500","1163300","1446500","1396500","-50000","2029.09.30"
"DOWN","(주)레드스톤시스템","25618463","데스크톱컴퓨터, 레드스톤시스템, DMY-4566HMPF, Intel Core i5 14500(2.6GHz)","1164500","1164500","1164500","1163300","1164500","1446500","1396500","-50000","2029.09.30"
"SAME","(주)한성컴퓨터","25468281","데스크톱컴퓨터, 한성컴퓨터, T7-A71650V0, AMD Ryzen7 PRO 7745(3.8GHz)","1164900","1164900","1164900","1164500","1164500","1470200","1470200","0","2027.08.08"
"SAME","주식회사 기린","25661575","데스크톱컴퓨터, 기린, KR176-T4532300, Intel&nbsp;Core&nbsp;i5-14500(2.6GHz)","1167430","1167430","1167430","1164900","1164900","1666430","1666430","0","2029.09.30"
"SAME","주식회사 엔와이컴퓨터","25554362","데스크톱컴퓨터, 엔와이컴퓨터, NY-E145SIB00, Intel Core i5 14500(2.6GHz)","1168900","","","","","",,"0","2029.09.30"
"SAME","(주)유투","26023419","데스크톱컴퓨터, 유투, LT5E2-520/B, Intel Core i5 14500(2.6GHz)","1169000","1169000","1169000","1168000","1168000","1459000","1459000","0","2029.09.30"
"SAME","(주)유투","25479171","데스크톱컴퓨터, 유투, S7E2-500/B, Intel Core i7 14700(2.1GHz)","1171000","1171000","1171000","1169000","1169000","1471500","1471500","0","2029.09.30"
