"NEW","주식회사 삼보컴퓨터","25569999","데스크톱컴퓨터, 삼보컴퓨터, DT281-GC71Q-006, Intel Core i7 14700(2.1GHz)","1328000","","","","","","1835000","0","2029.09.30"
"SAME","주식회사 다온인포","25847360","데스크톱컴퓨터, 다온인포, M65-U7-22200, Intel Core Ultra7 265(2.4GHz)","1328000","1328000","1328000","1328000","1328000","1328000","1328000","0","2029.09.30"
"SAME","주식회사 티원엘에스","25859228","검색결과1,931건판매량순낮은가격순평점순최신등록순납품사례많은순","1328100","1328100","1328100","1328000","1328100","1540200","1540200","0","2029.03.18"
"SAME","주식회사 티원엘에스","25859230","데스크톱컴퓨터, 티원엘에스, TSB-D719A00N, Intel Core i7 14700(2.1GHz)","1328100","1328100","1328100","1328100","1328000","1540200","1540200","0","2029.03.18"
"NEW","위메이드 보호작업장","25638709","데스크톱컴퓨터, 위메이드 보호작업장, RTS-741M5VZ, Intel Core i7 14700(2.1GHz)","1329500","","","","","","1816500","0","2026.07.19"
"NEW","위메이드 보호작업장","25638702","데스크톱컴퓨터, 위메이드 보호작업장, RTM-741M5VZ, Intel Core i7 14700(2.1GHz)","1329500","","","","","","1816500","0","2026.07.19"
"SAME","주식회사누리나루","25748058","데스크톱컴퓨터, 누리나루, NRM-371020, Intel Core i7-13700(2.1GHz)","1330000","1330000","1330000","1330000","1330000","1330000",,"0","2029.09.30"
"SAME","주식회사누리나루","25748001","데스크톱컴퓨터, 누리나루, NRM-471020, Intel Core i7-14700(2.1GHz)","1335000","1335000","1335000","1332900","1332900","1335000",,"0","2029.09.30"
"SAME","(주)유투","25769656","데스크톱컴퓨터, 유투, AT7E2-520/B, AMD Ryzen7 PRO 7745(3.8GHz)","1336000","1336000","1336000","1335000","1335000","1558900","1558900","0","2029.09.30"
"UP","주식회사 주연테크","25694279","데스크톱컴퓨터, 주연테크, JS-U7F1TS, Intel Core Ultra 7 265K(3.9GHz)","1336500","1336500","1336500","1336500","1336500","1336500","1528500","192000","2029.09.30"
"UP","주식회사 주연테크","25694250","데스크톱컴퓨터, 주연테크, JA-U7F1TS, Intel Core Ultra 7 265K(3.9GHz)","1336500","1336500","1336500","1336000","1336000","1336500","1528500","192000","2029.09.30"
"UP","주식회사 에이치케이시스템","25770765","데스크톱컴퓨터, 에이치케이시스템, HSB5-BX5050, Intel Core i5 14500(2.6GHz)","1337000","1337000","1337000","1336500","1336500","1337000","1567900","230900","2029.09.30"
"SAME","(주)다컴시스템","25586014","데스크톱컴퓨터, 다컴시스템, SI4FKM-4E00BA, Intel Core i7 14700(2.1GHz)","1338000","1338000","1338000","1338000","1338000","1700000","1700000","0","2029.09.30"
"SAME","(주)다컴시스템","25586015","데스크톱컴퓨터, 다컴시스템, MI4FKD-4E00BA, Intel Core i7 14700(2.1GHz)","1338000","1338000","1338000","1337000","1337000","1700000","1700000","0","2029.09.30"
"SAME","(주)한성컴퓨터","25099030","데스크톱컴퓨터, 한성컴퓨터, S13-B773212V5, Intel Core i7 13700(2.1GHz)","1339800","1339800","1339800","1339800","1339800","1745700","1745700","0","2027.08.08"
"SAME","(주)한성컴퓨터","25099032","데스크톱컴퓨터, 한성컴퓨터, T13-X773212V5, Intel Core i7 13700(2.1GHz)","1339800","1339800","1339800","1338000","1338000","1745700","1745700","0","2027.08.08"
"UP","주식회사 주연테크","25694249","데스크톱컴퓨터, 주연테크, JA-U7F5SH, Intel Core Ultra 7 265K(3.9GHz)","1341700","1341700","1341700","1341700","1341700","1341700","1580700","239000","2029.09.30"
"UP","주식회사 주연테크","25694278","데스크톱컴퓨터, 주연테크, JS-U7F5SH, Intel Core Ultra 7 265K(3.9GHz)","1341700","1341700","1341700","1339800","1339800","1341700","1580700","239000","2029.09.30"
"NEW","(주)레드스톤시스템","25618458","데스크톱컴퓨터, 레드스톤시스템, DMY-4769HMP, Intel Core i7 14700(2.1GHz)","1342000","1342000","1342000","1342000","1342000","","1821000","0","2029.09.30"
"NEW","(주)레드스톤시스템","25618484","데스크톱컴퓨터, 레드스톤시스템, CSY-4769HMP, Intel Core i7 14700(2.1GHz)","1342000","1342000","1342000","1342000","1342000","","1817000","0","2029.09.30"
"SAME","주식회사 대우루컴즈","25563977","데스크톱컴퓨터, 대우루컴즈, DS367A-4765C0, Intel Core i7 14700(2.1GHz)","1345000","1345000","1345000","1342000","1345000","1702000","1702000","0","2029.09.30"
"SAME","주식회사 대우루컴즈","25563989","데스크톱컴퓨터, 대우루컴즈, DT367B-4765C0, Intel Core i7 14700(2.1GHz)","1345000","1345000","1345000","1345000","1342000","1702000","1702000","0","2029.09.30"
"SAME","주식회사 에이텍컴퓨터","25569854","데스크톱컴퓨터, 에이텍컴퓨터, A4SQ-7NBJN, Intel Core i7 14700(2.1GHz)","1345000","1345000","1345000","1345000","1345000","1702000","1702000","0","2029.09.30"
"SAME","주식회사 에이텍컴퓨터","25569898","데스크톱컴퓨터, 에이텍컴퓨터, A4TQ-7NBJN, Intel Core i7 14700(2.1GHz)","1345000","1345000","1345000","1345000","1345000","1702000","1702000","0","2029.09.30"
"UP","주식회사 에이치케이시스템","25770785","데스크톱컴퓨터, 에이치케이시스템, HSC7-BY50P0, Intel Core i7 14700(2.1GHz)","1351000","1351000","1351000","1345000","1345000","1351000","1831900","480900","2029.09.30"
"SAME","주식회사 엔와이컴퓨터","25558764","데스크톱컴퓨터, 엔와이컴퓨터, NY-E147QIB00, Intel Core i7 14700(2.1GHz)","1353000","1353000","1353000","1351000","1351000","1715100","1715100","0","2029.09.30"
"SAME","주식회사 엔와이컴퓨터","25558783","데스크톱컴퓨터, 엔와이컴퓨터, NY-P147QIB00, Intel Core i7 14700(2.1GHz)","1353000","1353000","1353000","1353000","1353000","1715100","1715100","0","2029.09.30"
"UP","주식회사 에이치케이시스템","25769833","데스크톱컴퓨터, 에이치케이시스템, HTB7-BXE0P0, Intel Core i7 14700(2.1GHz)","1353500","1353500","1353500","1353000","1353000","1353500","1670000","316500","2029.09.30"
"UP","주식회사 에이치케이시스템","25770771","데스크톱컴퓨터, 에이치케이시스템, HSB7-BXE0P0, Intel Core i7 14700(2.1GHz)","1353500","1353500","1353500","1353500","1353500","1353500","1670000","316500","2029.09.30"
"SAME","위더스컴퓨터 주식회사","25779568","데스크톱컴퓨터, 위더스컴퓨터, B8L-57N5H216, Intel Core Ultra 7 265(2.4GHz)","1354000","1354000","1354000","1353500","1353500","1586000","1586000","0","2029.09.30"
"UP","주식회사 인비전","25738655","데스크톱컴퓨터, 인비전, IV-M757165S1H2, Intel Core i7 14700(2.1GHz)","1355000","1355000","1355000","1354000","1354000","1355000","1684400","329400","2029.09.30"
"UP","네오프랜드(주)","25590591","데스크톱컴퓨터, 네오프랜드, NDI74M4-C15N, Intel Core i7 14700(2.1GHz)","1361000","1361000","1361000","1355000","1355000","1361000","1881140","520140","2026.08.03"
"UP","주식회사 에이치케이시스템","25770781","데스크톱컴퓨터, 에이치케이시스템, HSC5-BYE0P0, Intel Core i5 14500(2.6GHz)","1362500","1362500","1362500","1361000","1361000","1362500","1877600","515100","2029.09.30"
"SAME","주식회사 기린","25661583","데스크톱컴퓨터, 기린, KR176-S4732320, Intel&nbsp;Core&nbsp;i7-14700(2.1GHz)","1367130","1367130","1367130","1362500","1362500","",,"0","2029.09.30"
"UP","주식회사 에이치케이시스템","25770795","데스크톱컴퓨터, 에이치케이시스템, HG7C-DXU0P0, AMD Ryzen9 7900(3.7GHz)","1367200","1367200","1367200","1367130","1367130","1367200","1545700","178500","2029.09.30"
"SAME","(주)한성컴퓨터","25803992","데스크톱컴퓨터, 한성컴퓨터, T14-B771615V0, Intel Core i7 14700(2.1GHz)","1370400","1370400","1370400","1367200","1367200","1668300","1668300","0","2027.08.08"
"SAME","위메이드 보호작업장","25229321","데스크톱컴퓨터, 위메이드 보호작업장, RTM-F21M5V5, Intel Core i5 13500(2.5GHz)","1373900","1373900","1373900","1373900","1370400","1654500","1654500","0","2026.07.19"
"SAME","위메이드 보호작업장","25229336","데스크톱컴퓨터, 위메이드 보호작업장, RTS-F21M5V5, Intel Core i5 13500(2.5GHz)","1373900","1373900","1373900","1370400","1373900","1654500","1654500","0","2026.07.19"
"SAME","(주)한성컴퓨터","25804000","데스크톱컴퓨터, 한성컴퓨터, T15-B851615V0, Intel Core Ultra 5 235(3.4GHz)","1376400","1376400","1376400","1373900","1373900","1674300","1674300","0","2027.08.08"
"SAME","주식회사 기린","25661577","데스크톱컴퓨터, 기린, KR176-T4732320, Intel&nbsp;Core&nbsp;i7-14700(2.1GHz)","1377130","1377130","1377130","1376400","1376400","",,"0","2029.09.30"
"SAME","위메이드 보호작업장","25638703","데스크톱컴퓨터, 위메이드 보호작업장, RTM-S4ZM56VZ, Intel Core i7 14700(2.1GHz)","1380100","","","","","",,"0","2026.07.19"
"SAME","위메이드 보호작업장","25638708","데스크톱컴퓨터, 위메이드 보호작업장, RTS-S4ZM56VZ, Intel Core i7 14700(2.1GHz)","1380100","","","","","",,"0","2026.07.19"
"SAME","삼호글로벌 주식회사","25495056","데스크톱컴퓨터, 삼호글로벌, KOPS-JF1340P-S5YS1, Intel Core i5 1340P(1.9GHz)","1382900","1382900","1382900","1377130","1377130","1567500","1567500","0","2029.04.22"
"NEW","주식회사 비엔피","24663399","데스크톱컴퓨터, 비엔피, B5M-2T16S5H1/G50, Intel Core i5 12500(3.0GHz)","1384400","1384400","1384400","1382900","1382900","","1827400","0","2029.09.30"
"SAME","(주)유투","25034164","데스크톱컴퓨터, 유투, T7D4-A20/B, Intel Core i7 13700(2.1GHz)","1386700","1386700","1386700","1384400","1384400","",,"0","2029.09.30"
"SAME","주식회사 에이치케이시스템","25770772","데스크톱컴퓨터, 에이치케이시스템, HSB7-BY52P0, Intel Core i7 14700(2.1GHz)","1391200","1391200","1391200","1386700","1386700","1391200",,"0","2029.09.30"
"SAME","주식회사 에이치케이시스템","25769834","데스크톱컴퓨터, 에이치케이시스템, HTB7-BY52P0, Intel Core i7 14700(2.1GHz)","1391200","1391200","1391200","1391200","1391200","1391200",,"0","2029.09.30"
"UP","네오프랜드(주)","24645809","데스크톱컴퓨터, 네오프랜드, NDI72M2-C12U, Intel Core i7 12700(2.1GHz)","1398770","1398770","1398770","1391200","1391200","1398770","1859290","460520","2026.08.03"
"SAME","주식회사 엔와이컴퓨터","25817158","데스크톱컴퓨터, 엔와이컴퓨터, NY-P147SI04A, Intel Core i7 14700(2.1GHz)","1399700","1399700","1399700","1398770","1398770","1689100","1689100","0","2029.09.30"
"UP","주식회사 주연테크","25694239","데스크톱컴퓨터, 주연테크, JA-U5F1T2TS, Intel Core Ultra 5 245K(4.2GHz)","1402900","1402900","1402900","1399700","1399700","1402900","1656900","254000","2029.09.30"
"UP","주식회사 주연테크","25694268","데스크톱컴퓨터, 주연테크, JS-U5F1T2TS, Intel Core Ultra 5 245K(4.2GHz)","1402900","1402900","1402900","1402900","1402900","1402900","1656900","254000","2029.09.30"
"UP","주식회사 에이치케이시스템","25769846","데스크톱컴퓨터, 에이치케이시스템, HTC7-BXE0P0, Intel Core i7 14700(2.1GHz)","1403500","1403500","1403500","1402900","1402900","1403500","1720000","316500","2029.09.30"
"UP","주식회사 에이치케이시스템","25770784","데스크톱컴퓨터, 에이치케이시스템, HSC7-BXE0P0, Intel Core i7 14700(2.1GHz)","1403500","1403500","1403500","1403500","1403500","1403500","1720000","316500","2029.09.30"
"SAME","주식회사 인텍","25319768","데스크톱컴퓨터, 인텍, IT176-T3516307, Intel Core i5-13500(2.5GHz)","1405900","1405900","1405900","1403500","1403500","1693900","1693900","0","2029.03.14"
"NEW","주식회사 티원엘에스","24878989","데스크톱컴퓨터, 티원엘에스, TMB-C73915, Intel Core i7 13700(2.1GHz)","1408400","1408400","1408400","1405900","1405900","","1780900","0","2029.03.18"
"UP","주식회사 주연테크","25694282","데스크톱컴퓨터, 주연테크, JS-U72F1TS, Intel Core Ultra 7 265K(3.9GHz)","1412000","1412000","1412000","1408400","1408400","1412000","1809000","397000","2029.09.30"
"UP","주식회사 주연테크","25694258","데스크톱컴퓨터, 주연테크, JA-U72F1TS, Intel Core Ultra 7 265K(3.9GHz)","1412000","1412000","1412000","1412000","1412000","1412000","1809000","397000","2029.09.30"
"NEW","주식회사 아이티에스","25155351","데스크톱컴퓨터, 아이티에스, ITS-DT13-G7C51V6, Intel Core i7 13700(2.1GHz)","1414000","1414000","1414000","1412000","1412000","","1884000","0","2028.02.12"
"SAME","주식회사 비엔피","25031939","데스크톱컴퓨터, 비엔피, B7M-3T16S5H1/G50, Intel Core i7 13700(2.1GHz)","1414800","1414800","1414800","1414000","1414000","1713800","1713800","0","2029.09.30"
"NEW","오렌지보호작업장","25613341","데스크톱컴퓨터, 오렌지보호작업장, OMG-47001, Intel Core i7 14700(2.1GHz)","1415000","1415000","1415000","1414800","1414800","","1856000","0","2029.09.30"
"SAME","(주)한성컴퓨터","25804001","데스크톱컴퓨터, 한성컴퓨터, T15-B871651V0, Intel Core Ultra 7 265(2.4GHz)","1416500","1416500","1416500","1415000","1415000","1708900","1708900","0","2027.08.08"
"UP","주식회사 주연테크","25694256","데스크톱컴퓨터, 주연테크, JA-U72F5SH, Intel Core Ultra 7 265K(3.9GHz)","1417200","1417200","1417200","1416500","1416500","1417200","1861200","444000","2029.09.30"
"UP","주식회사 주연테크","25694230","데스크톱컴퓨터, 주연테크, JS-U72F5SH, Intel Core Ultra 7 265K(3.9GHz)","1417200","1417200","1417200","1417200","1417200","1417200","1861200","444000","2029.09.30"
"NEW","(주)유투","25769654","데스크톱컴퓨터, 유투, AT7E4-520/B, AMD Ryzen7 PRO 7745(3.8GHz)","1419000","1419000","1419000","1418900","1418900","","1803400","0","2029.09.30"
"SAME","위메이드 보호작업장","25638712","데스크톱컴퓨터, 위메이드 보호작업장, RTS-F22M5V6, Intel Core i5 14500(2.6GHz)","1420200","1420200","1420200","1419000","1419000","1725100","1725100","0","2026.07.19"
"SAME","주식회사 트리엠","25726667","데스크톱컴퓨터, 트리엠, TX4-RB7-506R35, Intel Core i7-14700(2.1GHz)","1421700","1421700","1421700","1420200","1420200","1742000","1742000","0","2029.06.25"
"SAME","주식회사 에이치케이시스템","25769829","데스크톱컴퓨터, 에이치케이시스템, HTB7-AYE0P0, Intel Core i7 13700(2.1GHz)","1422300","1422300","1422300","1422300","1422300","1422300",,"0","2029.09.30"
"SAME","주식회사 에이치케이시스템","25770759","데스크톱컴퓨터, 에이치케이시스템, HSB7-AYE0P0, Intel Core i7 13700(2.1GHz)","1422300","1422300","1422300","1421700","1421700","1422300",,"0","2029.09.30"
"SAME","주식회사 티원엘에스","25855497","데스크톱컴퓨터, 티원엘에스, TMB-D51925S, Intel Core i5 14500(2.6GHz)","1424100","1424100","1424100","1422300","1422300","1594600","1594600","0","2029.03.18"
"UP","주식회사 에이치케이시스템","25770766","데스크톱컴퓨터, 에이치케이시스템, HSB5-BX5250, Intel Core i5 14500(2.6GHz)","1427200","1427200","1427200","1424100","1424100","1427200","1682400","255200","2029.09.30"
"UP","주식회사 에이치케이시스템","25769823","데스크톱컴퓨터, 에이치케이시스템, HTB5-BX5250, Intel Core i5 14500(2.6GHz)","1427200","1427200","1427200","1427200","1427200","1427200","1682400","255200","2029.09.30"
"SAME","주식회사 기린","25309003","데스크톱컴퓨터, 기린, KR176-T3516307, Intel Core i5-13500(2.5GHz)","1427400","1427400","1427400","1427200","1427200","1700400","1700400","0","2029.09.30"
"UP","주식회사 서버앤컴퓨터","24589661","데스크톱컴퓨터, 서버앤컴퓨터, DODE-T71622R50, Intel Core i7 12700(2.1GHz)","1429000","1429000","1429000","1428000","1428000","1429000","1684000","255000","2026.04.29"
"DOWN","(주)레드스톤시스템","25638020","데스크톱컴퓨터, 레드스톤시스템, DMY-4505BHL, Intel Core i5 14500(2.6GHz)","1430500","1430500","1430500","1429000","1429000","1712500","1628500","-84000","2029.09.30"
"SAME","위더스컴퓨터 주식회사","24521191","데스크톱컴퓨터, 위더스컴퓨터, H6S-70N5H232-V50, Intel Core i7 12700(2.1GHz)","1432000","1432000","1432000","1432000","1432000","",,"0","2029.09.30"
"SAME","위더스컴퓨터 주식회사","24521194","데스크톱컴퓨터, 위더스컴퓨터, H6T-70N5H232-V50, Intel Core i7 12700(2.1GHz)","1432000","1432000","1432000","1430500","1430500","",,"0","2029.09.30"
"NEW","사단법인 나너우리","25785869","데스크톱컴퓨터, 나너우리, IYU-M45RF, Intel Core i5 14500(2.6GHz)","1433900","1433900","1433900","1432900","1432900","","1773900","0","2029.09.30"
"UP","(주)컴트리","25797483","데스크톱컴퓨터, 컴트리, CS4-E53-BS0001, Intel Core i5 14500(2.6GHz)","1434310","1434310","1434310","1433900","1433900","1434310","1850610","416300","2029.09.30"
"SAME","(주)유투","25545868","데스크톱컴퓨터, 유투, T5E2-52E/B, Intel Core i5 14500(2.6GHz)","1437400","1437400","1437400","1434310","1434310","1735200","1735200","0","2029.09.30"
"SAME","주식회사 에이치케이시스템","25769848","데스크톱컴퓨터, 에이치케이시스템, HTC7-BY52P0, Intel Core i7 14700(2.1GHz)","1441200","1441200","1441200","1437400","1437400","1441200",,"0","2029.09.30"
"SAME","주식회사 에이치케이시스템","25770786","데스크톱컴퓨터, 에이치케이시스템, HSC7-BY52P0, Intel Core i7 14700(2.1GHz)","1441200","1441200","1441200","1441200","1441200","1441200",,"0","2029.09.30"
"UP","(주)컴트리","25797486","데스크톱컴퓨터, 컴트리, CS4-E71-BS0002, Intel Core i7 14700(2.1GHz)","1442310","1442310","1442310","1441200","1441200","1442310","1743610","301300","2029.09.30"
"SAME","네오프랜드(주)","24645810","데스크톱컴퓨터, 네오프랜드, NDI72M2-D12U, Intel Core i7 12700(2.1GHz)","1452040","1452040","1452040","1448000","1448000","1452040",,"0","2026.08.03"
"SAME","삼호글로벌 주식회사","25495049","데스크톱컴퓨터, 삼호글로벌, KOPS-14ULTRA5-165NN, Intel Core ULTRA5-125H(3.6GHz)","1456500","1456500","1456500","1452040","1452040","1678000","1678000","0","2029.04.22"
"NEW","주식회사 티원엘에스","25634786","데스크톱컴퓨터, 티원엘에스, TMB-D7192ES, Intel Core i7 14700(2.1GHz)","1457800","1457800","1457800","1456500","1456500","","1770900","0","2029.03.18"
"UP","(주)컴트리","25797482","데스크톱컴퓨터, 컴트리, CS4-E71-BK0001, Intel Core i7 14700(2.1GHz)","1458710","1458710","1458710","1457800","1457800","1458710","1782510","323800","2029.09.30"
"SAME","오렌지보호작업장","25613342","데스크톱컴퓨터, 오렌지보호작업장, OMG-47002, Intel Core i7 14700(2.1GHz)","1460000","1460000","1460000","1458710","1458710","",,"0","2029.09.30"
"NEW","주식회사 비엔피","25031936","데스크톱컴퓨터, 비엔피, B7M-3T16S1H1/G50, Intel Core i7 13700(2.1GHz)","1466000","1466000","1466000","1460000","1460000","","1785000","0","2029.09.30"
"SAME","주식회사 에이치케이시스템","25769835","데스크톱컴퓨터, 에이치케이시스템, HTB7-BYE0P0, Intel Core i7 14700(2.1GHz)","1467500","1467500","1467500","1466000","1467500","1467500",,"0","2029.09.30"
"SAME","주식회사 에이치케이시스템","25770773","데스크톱컴퓨터, 에이치케이시스템, HSB7-BYE0P0, Intel Core i7 14700(2.1GHz)","1467500","1467500","1467500","1467500","1466000","1467500",,"0","2029.09.30"
"SAME","(주)레드스톤시스템","25331307","데스크톱컴퓨터, 레드스톤시스템, DMY-3766HLT, Intel Core i7 13700(2.1GHz)","1469000","1469000","1469000","1467500","1467500","1762000","1762000","0","2029.09.30"
"NEW","삼호글로벌 주식회사","25193215","데스크톱컴퓨터, 삼호글로벌, KOPS-F12S55-HHN, Intel Core i7 1255U(1.7GHz)","1469500","1469500","1469500","1469500","1469500","","1802800","0","2029.04.22"
"NEW","주식회사 스마트인디지털","25653030","데스크톱컴퓨터, 스마트인디지털, SLM5-PGESBT(406), Intel Core i5-14500(2.6GHz)","1475000","1475000","1475000","1469500","1469500","","1785700","0","2029.09.30"
"SAME","주식회사 주연테크","25694277","데스크톱컴퓨터, 주연테크, JS-U52F1T2TS, Intel Core Ultra 5 245K(4.2GHz)","1478400","1478400","1478400","","","",,"0","2029.09.30"
"SAME","주식회사 주연테크","25694247","데스크톱컴퓨터, 주연테크, JA-U52F1T2TS, Intel Core Ultra 5 245K(4.2GHz)","1478400","1478400","1478400","1475000","1475000","1478400",,"0","2029.09.30"
"UP","주식회사 서버앤컴퓨터","24589662","데스크톱컴퓨터, 서버앤컴퓨터, DODE-T71625R50, Intel Core i7 12700(2.1GHz)","1484000","1484000","1484000","1482900","1482900","1484000","1785000","301000","2026.04.29"
"NEW","주식회사 대우루컴즈","25563993","데스크톱컴퓨터, 대우루컴즈, DT367B-476508, Intel Core i7 14700(2.1GHz)","1485000","1485000","1485000","1484000","1484000","","1804000","0","2029.09.30"
"NEW","주식회사 에이텍컴퓨터","25569895","데스크톱컴퓨터, 에이텍컴퓨터, A4TQ-7HBDN, Intel Core i7 14700(2.1GHz)","1485000","1485000","1485000","1485000","1485000","","1804000","0","2029.09.30"
"SAME","주식회사 비엔피","24663407","데스크톱컴퓨터, 비엔피, B7M-2T16S5H1/G35, Intel Core i7 12700(2.1GHz)","1497000","1497000","1497000","1485000","1485000","",,"0","2029.09.30"
"SAME","주식회사 티원엘에스","25855496","데스크톱컴퓨터, 티원엘에스, TMB-D71925S, Intel Core i7 14700(2.1GHz)","1500600","1500600","1500600","1499400","1499400","1712700","1712700","0","2029.03.18"
"SAME","주식회사 에이치케이시스템","25769843","데스크톱컴퓨터, 에이치케이시스템, HTC5-BY5050, Intel Core i5 14500(2.6GHz)","1501000","1501000","1501000","1500600","1500600","1501000",,"0","2029.09.30"
"UP","주식회사 서버앤컴퓨터","24589663","데스크톱컴퓨터, 서버앤컴퓨터, DODE-T716210R50, Intel Core i7 12700(2.1GHz)","1516000","1516000","1516000","1501000","1501000","1516000","1803200","287200","2026.04.29"
"SAME","주식회사 비엔피","24663396","데스크톱컴퓨터, 비엔피, B5M-2T16S5H1/G60, Intel Core i5 12500(3.0GHz)","1516900","1516900","1516900","1516000","1516000","",,"0","2029.09.30"
"SAME","주식회사 에이치케이시스템","25770787","데스크톱컴퓨터, 에이치케이시스템, HSC7-BYE0P0, Intel Core i7 14700(2.1GHz)","1517500","1517500","1517500","1517500","1517500","1517500",,"0","2029.09.30"
"SAME","주식회사 에이치케이시스템","25769849","데스크톱컴퓨터, 에이치케이시스템, HTC7-BYE0P0, Intel Core i7 14700(2.1GHz)","1517500","1517500","1517500","1516900","1516900","1517500",,"0","2029.09.30"
"SAME","네오프랜드(주)","25590588","데스크톱컴퓨터, 네오프랜드, NDI54M4-C15A, Intel Core i5 14500(2.6GHz)","1522000","1522000","1522000","1517500","1517500","1522000",,"0","2026.08.03"
"SAME","주식회사 인텍","25822917","데스크톱컴퓨터, 인텍, ITA176-T4532307, IntelCore i5-14500(2.6GHz)","1523000","1523000","1523000","1522000","1522000","",,"0","2029.03.14"
"NEW","주식회사 인텍","25319770","데스크톱컴퓨터, 인텍, IT176-T3516327, Intel Core i5-13500(2.5GHz)","1524900","1524900","1524900","1523000","1523000","","1842900","0","2029.03.14"
"NEW","주식회사 트리엠","25726669","데스크톱컴퓨터, 트리엠, TX4-RB7-506R46, Intel Core i7-14700(2.1GHz)","1545900","","","","","","1866400","0","2029.06.25"
"SAME","삼호글로벌 주식회사","25495050","데스크톱컴퓨터, 삼호글로벌, KOPS-14ULTRA5-325NN, Intel CoreULTRA5-125H(3.6GHz)","1547100","1547100","","1524900","1524900","",,"0","2029.04.22"
"SAME","삼호글로벌 주식회사","25495046","데스크톱컴퓨터, 삼호글로벌, KOPS-KS1355H-SS5NN, Intel Core i7 1355U(1.7GHz)","1550200","1550200","","1547100","1547100","",,"0","2029.04.22"
"NEW","주식회사 인텍","25822916","데스크톱컴퓨터, 인텍, ITA176-T4516327, IntelCore i5-14500(2.6GHz)","1553000","1553000","","1550200","1550200","","1816300","0","2029.03.14"
"SAME","사단법인 나너우리","25785870","데스크톱컴퓨터, 나너우리, IYU-M451RF, Intel Core i5 14500(2.6GHz)","1553900","1553900","","1553000","1553000","",,"0","2029.09.30"
"SAME","(주)다컴시스템","25586025","데스크톱컴퓨터, 다컴시스템, MI4FKD-4643BA, Intel Core i7 14700(2.1GHz)","1555000","","","","","",,"0","2029.09.30"
"NEW","삼호글로벌 주식회사","25193219","데스크톱컴퓨터, 삼호글로벌, KOPS-12K70PHS0, Intel Core i7 1270P(2.2GHz)","1561500","1561500","","1553900","1553900","","1887600","0","2029.04.22"
"UP","주식회사 주연테크","25694280","데스크톱컴퓨터, 주연테크, JS-U7F1T2TS, Intel Core Ultra 7 265K(3.9GHz)","1562900","1562900","","1561500","1562900","1562900","1816900","254000","2029.09.30"
"UP","주식회사 주연테크","25694251","데스크톱컴퓨터, 주연테크, JA-U7F1T2TS, Intel Core Ultra 7 265K(3.9GHz)","1562900","1562900","","1562900","1561500","1562900","1816900","254000","2029.09.30"
"SAME","주식회사 엔와이컴퓨터","25564174","데스크톱컴퓨터, 엔와이컴퓨터, NY-P147QI34A, Intel Core i7 14700(2.1GHz)","1570000","1570000","","1568900","1568900","",,"0","2029.09.30"
"SAME","주식회사 대우루컴즈","25563983","데스크톱컴퓨터, 대우루컴즈, DT367B-476528, Intel Core i7 14700(2.1GHz)","1571000","1571000","","1570000","1570000","",,"0","2029.09.30"
"SAME","주식회사 에이텍컴퓨터","25569896","데스크톱컴퓨터, 에이텍컴퓨터, A4TQ-7HBDF, Intel Core i7 14700(2.1GHz)","1571000","1571000","","1571000","1571000","",,"0","2029.09.30"
